[
  {
    "id": "art_001",
    "title": {
      "vi": "Buổi Sáng Ở Hà Nội",
      "en": "Morning in Hanoi",
      "zh": "河内的早晨"
    },
    "category": "daily-life",
    "cefrLevel": "A1",
    "imageUrl": "https://images.unsplash.com/photo-1557750255-c76072a7aad1?w=600&h=300&fit=crop",
    "readingTimeMins": 2,
    "sentences": [
      {
        "vi": "Buổi sáng ở Hà Nội rất đẹp.",
        "en": "Mornings in Hanoi are very beautiful.",
        "zh": "河内的早晨非常美丽。"
      },
      {
        "vi": "Người dân thường dậy sớm.",
        "en": "People usually wake up early.",
        "zh": "人们通常很早起床。"
      },
      {
        "vi": "Họ đi tập thể dục ở hồ Hoàn Kiếm.",
        "en": "They exercise at Hoan Kiem Lake.",
        "zh": "他们在还剑湖锻炼。"
      },
      {
        "vi": "Sau đó, nhiều người uống cà phê trứng.",
        "en": "Afterwards, many people drink egg coffee.",
        "zh": "之后，很多人喝蛋咖啡。"
      },
      {
        "vi": "Cà phê trứng là đặc sản của Hà Nội.",
        "en": "Egg coffee is a specialty of Hanoi.",
        "zh": "蛋咖啡是河内的特产。"
      },
      {
        "vi": "Phố cổ bắt đầu nhộn nhịp từ sáng sớm.",
        "en": "The Old Quarter becomes lively from early morning.",
        "zh": "古街从清晨就开始热闹起来。"
      },
      {
        "vi": "Tiếng rao hàng vang khắp con phố.",
        "en": "Street vendor calls echo throughout the streets.",
        "zh": "小贩的叫卖声回荡在街头。"
      },
      {
        "vi": "Đây là một ngày mới tuyệt vời ở Hà Nội.",
        "en": "This is a wonderful new day in Hanoi.",
        "zh": "这是河内美好的新一天。"
      }
    ]
  },
  {
    "id": "art_002",
    "title": {
      "vi": "Phở — Linh Hồn Ẩm Thực Việt",
      "en": "Pho — The Soul of Vietnamese Cuisine",
      "zh": "越南河粉——越南美食之魂"
    },
    "category": "food",
    "cefrLevel": "A1",
    "imageUrl": "https://images.unsplash.com/photo-1503764654157-72d979d9af2f?w=600&h=300&fit=crop",
    "readingTimeMins": 2,
    "sentences": [
      {
        "vi": "Phở là món ăn nổi tiếng nhất của Việt Nam.",
        "en": "Pho is the most famous dish of Vietnam.",
        "zh": "河粉是越南最著名的菜肴。"
      },
      {
        "vi": "Phở có nước dùng nóng, bánh phở và thịt.",
        "en": "Pho has hot broth, rice noodles, and meat.",
        "zh": "河粉有热汤、米粉和肉。"
      },
      {
        "vi": "Có hai loại phổ biến: phở bò và phở gà.",
        "en": "There are two popular types: beef pho and chicken pho.",
        "zh": "有两种常见的：牛肉河粉和鸡肉河粉。"
      },
      {
        "vi": "Người Việt ăn phở vào buổi sáng.",
        "en": "Vietnamese people eat pho in the morning.",
        "zh": "越南人早上吃河粉。"
      },
      {
        "vi": "Nhưng bạn có thể ăn phở bất cứ lúc nào.",
        "en": "But you can eat pho anytime.",
        "zh": "但你随时都可以吃河粉。"
      },
      {
        "vi": "Khi ăn phở, bạn thêm rau thơm và giá.",
        "en": "When eating pho, you add herbs and bean sprouts.",
        "zh": "吃河粉时，你可以加香草和豆芽。"
      },
      {
        "vi": "Một bát phở ngon khiến bạn rất hạnh phúc.",
        "en": "A delicious bowl of pho makes you very happy.",
        "zh": "一碗美味的河粉让你非常幸福。"
      }
    ]
  },
  {
    "id": "art_003",
    "title": {
      "vi": "Tết Nguyên Đán",
      "en": "Lunar New Year",
      "zh": "越南春节"
    },
    "category": "culture",
    "cefrLevel": "B1",
    "imageUrl": "https://images.unsplash.com/photo-1548266652-99cf27701be1?w=600&h=300&fit=crop",
    "readingTimeMins": 3,
    "sentences": [
      {
        "vi": "Tết Nguyên Đán là ngày lễ quan trọng nhất ở Việt Nam.",
        "en": "Lunar New Year is the most important holiday in Vietnam.",
        "zh": "春节是越南最重要的节日。"
      },
      {
        "vi": "Tết thường rơi vào tháng một hoặc tháng hai dương lịch.",
        "en": "Tet usually falls in January or February of the solar calendar.",
        "zh": "春节通常在公历一月或二月。"
      },
      {
        "vi": "Trước Tết, mọi người dọn dẹp nhà cửa sạch sẽ.",
        "en": "Before Tet, everyone cleans their houses thoroughly.",
        "zh": "春节前，大家把房子打扫得干干净净。"
      },
      {
        "vi": "Gia đình gói bánh chưng và bánh tét.",
        "en": "Families wrap banh chung and banh tet (traditional rice cakes).",
        "zh": "家人们包粽子和年糕。"
      },
      {
        "vi": "Đêm giao thừa, cả nhà quây quần bên nhau.",
        "en": "On New Year's Eve, the whole family gathers together.",
        "zh": "除夕夜，全家人团聚在一起。"
      },
      {
        "vi": "Trẻ em được nhận lì xì từ người lớn.",
        "en": "Children receive lucky money envelopes from adults.",
        "zh": "孩子们从大人那里收到红包。"
      },
      {
        "vi": "Người ta đi thăm bà con và bạn bè.",
        "en": "People visit relatives and friends.",
        "zh": "人们走亲访友。"
      },
      {
        "vi": "Hoa mai ở miền Nam và hoa đào ở miền Bắc là biểu tượng của Tết.",
        "en": "Yellow apricot blossoms in the South and peach blossoms in the North are symbols of Tet.",
        "zh": "南方的黄梅花和北方的桃花是春节的象征。"
      },
      {
        "vi": "Tết là thời gian để nhớ về nguồn cội và gia đình.",
        "en": "Tet is a time to remember one's roots and family.",
        "zh": "春节是缅怀根源和家庭的时刻。"
      }
    ]
  },
  {
    "id": "art_004",
    "title": {
      "vi": "Vịnh Hạ Long",
      "en": "Ha Long Bay",
      "zh": "下龙湾"
    },
    "category": "travel",
    "cefrLevel": "A1",
    "imageUrl": "https://images.unsplash.com/photo-1528127269322-539152f5ae14?w=600&h=300&fit=crop",
    "readingTimeMins": 2,
    "sentences": [
      {
        "vi": "Vịnh Hạ Long nằm ở tỉnh Quảng Ninh.",
        "en": "Ha Long Bay is located in Quang Ninh province.",
        "zh": "下龙湾位于广宁省。"
      },
      {
        "vi": "Đây là Di sản Thế giới được UNESCO công nhận.",
        "en": "It is a UNESCO World Heritage Site.",
        "zh": "这里是联合国教科文组织世界遗产。"
      },
      {
        "vi": "Vịnh có gần hai nghìn hòn đảo đá vôi.",
        "en": "The bay has nearly two thousand limestone islands.",
        "zh": "海湾有近两千个石灰岩岛屿。"
      },
      {
        "vi": "Du khách thường đi du thuyền ngắm cảnh.",
        "en": "Tourists often take cruise boats to enjoy the scenery.",
        "zh": "游客经常乘游船观光。"
      },
      {
        "vi": "Nước biển ở đây rất xanh và trong.",
        "en": "The sea water here is very blue and clear.",
        "zh": "这里的海水又蓝又清。"
      },
      {
        "vi": "Bạn có thể chèo thuyền kayak và bơi lội.",
        "en": "You can kayak and swim.",
        "zh": "你可以划皮划艇和游泳。"
      },
      {
        "vi": "Hạ Long là một trong những nơi đẹp nhất Việt Nam.",
        "en": "Ha Long is one of the most beautiful places in Vietnam.",
        "zh": "下龙是越南最美的地方之一。"
      }
    ]
  },
  {
    "id": "art_005",
    "title": {
      "vi": "Áo Dài Truyền Thống",
      "en": "The Traditional Ao Dai",
      "zh": "传统奥黛"
    },
    "category": "culture",
    "cefrLevel": "B1",
    "imageUrl": "https://images.unsplash.com/photo-1583417319070-4a69db38a482?w=600&h=300&fit=crop",
    "readingTimeMins": 2,
    "sentences": [
      {
        "vi": "Áo dài là trang phục truyền thống của Việt Nam.",
        "en": "The ao dai is the traditional costume of Vietnam.",
        "zh": "奥黛是越南的传统服装。"
      },
      {
        "vi": "Áo dài gồm áo dài tay và quần dài.",
        "en": "The ao dai consists of a long-sleeved tunic and long pants.",
        "zh": "奥黛由长袖上衣和长裤组成。"
      },
      {
        "vi": "Phụ nữ Việt Nam thường mặc áo dài trong dịp đặc biệt.",
        "en": "Vietnamese women often wear ao dai on special occasions.",
        "zh": "越南女性经常在特殊场合穿奥黛。"
      },
      {
        "vi": "Học sinh nữ mặc áo dài trắng đến trường.",
        "en": "Female students wear white ao dai to school.",
        "zh": "女学生穿白色奥黛去上学。"
      },
      {
        "vi": "Áo dài có nhiều màu sắc và họa tiết đẹp.",
        "en": "Ao dai comes in many beautiful colors and patterns.",
        "zh": "奥黛有很多美丽的颜色和图案。"
      },
      {
        "vi": "Ngày nay, áo dài được thiết kế hiện đại hơn.",
        "en": "Nowadays, ao dai is designed more modernly.",
        "zh": "如今，奥黛的设计更加现代。"
      },
      {
        "vi": "Áo dài là niềm tự hào của người Việt Nam.",
        "en": "The ao dai is the pride of Vietnamese people.",
        "zh": "奥黛是越南人的骄傲。"
      }
    ]
  },
  {
    "id": "art_006",
    "title": {
      "vi": "Chợ Bến Thành",
      "en": "Ben Thanh Market",
      "zh": "滨城市场"
    },
    "category": "daily-life",
    "cefrLevel": "B1",
    "imageUrl": "https://images.unsplash.com/photo-1583417267826-aebc4d1542e1?w=600&h=300&fit=crop",
    "readingTimeMins": 2,
    "sentences": [
      {
        "vi": "Chợ Bến Thành nằm ở trung tâm Thành phố Hồ Chí Minh.",
        "en": "Ben Thanh Market is in the center of Ho Chi Minh City.",
        "zh": "滨城市场位于胡志明市中心。"
      },
      {
        "vi": "Đây là một trong những ngôi chợ lâu đời nhất Sài Gòn.",
        "en": "It is one of the oldest markets in Saigon.",
        "zh": "这是西贡最古老的市场之一。"
      },
      {
        "vi": "Chợ bán đủ loại hàng hóa từ thực phẩm đến quần áo.",
        "en": "The market sells all kinds of goods from food to clothing.",
        "zh": "市场出售从食品到服装的各种商品。"
      },
      {
        "vi": "Bạn có thể mua trái cây tươi và đồ ăn vặt.",
        "en": "You can buy fresh fruit and snacks.",
        "zh": "你可以买新鲜水果和零食。"
      },
      {
        "vi": "Ở Việt Nam, bạn nên trả giá khi mua hàng ở chợ.",
        "en": "In Vietnam, you should bargain when shopping at markets.",
        "zh": "在越南，你应该在市场上讨价还价。"
      },
      {
        "vi": "Buổi tối, chợ đêm mở cửa bên ngoài.",
        "en": "In the evening, the night market opens outside.",
        "zh": "晚上，夜市在外面开张。"
      },
      {
        "vi": "Chợ Bến Thành là điểm du lịch không thể bỏ qua.",
        "en": "Ben Thanh Market is a must-visit tourist destination.",
        "zh": "滨城市场是不可错过的旅游景点。"
      }
    ]
  },
  {
    "id": "art_007",
    "title": {
      "vi": "Lịch Sử Thăng Long",
      "en": "The History of Thang Long",
      "zh": "升龙的历史"
    },
    "category": "history",
    "cefrLevel": "C1",